    1   0.000000 fe80::966a:77ff:fe4e:5b98 → ff02::1      ICMPv6 174 Router Advertisement from 94:6a:77:4e:5b:98
    2   0.163439   10.0.0.156 → 35.83.181.24 TLSv1.2 120 Application Data
    3   0.200929 35.83.181.24 → 10.0.0.156   TCP 66 443 → 58459 [ACK] Seq=1 Ack=55 Win=8 Len=0 TSval=1690050192 TSecr=2258852577
    4   0.200931 35.83.181.24 → 10.0.0.156   TLSv1.2 122 Application Data
    5   0.201044   10.0.0.156 → 35.83.181.24 TCP 66 58459 → 443 [ACK] Seq=55 Ack=57 Win=2047 Len=0 TSval=2258852615 TSecr=1690050193
    6   0.241439 172.217.12.106 → 10.0.0.156   TLSv1.2 152 Application Data
    7   0.241747   10.0.0.156 → 172.217.12.106 TCP 66 61019 → 443 [ACK] Seq=1 Ack=87 Win=2048 Len=0 TSval=3851037532 TSecr=3260477166
    8   0.299116 35.83.181.24 → 10.0.0.156   TLSv1.2 168 Application Data
    9   0.299362   10.0.0.156 → 35.83.181.24 TCP 66 58424 → 443 [ACK] Seq=1 Ack=103 Win=2046 Len=0 TSval=2244254876 TSecr=1798618911
   10   0.446550 169.254.100.1 → 239.255.255.250 SSDP 228 M-SEARCH * HTTP/1.1 
   11   0.446551 169.254.100.1 → 239.255.255.250 SSDP 232 M-SEARCH * HTTP/1.1 
   12   0.446552 169.254.100.1 → 239.255.255.250 SSDP 236 M-SEARCH * HTTP/1.1 
   13   0.448144 169.254.100.1 → 239.255.255.250 SSDP 229 M-SEARCH * HTTP/1.1 
   14   0.480141   10.0.0.156 → 65.8.161.48  TLSv1.2 105 Application Data
   15   0.484181 2601:645:8001:cc60::313b → 2001:558:feed:443::14 TLSv1.2 142 Application Data
   16   0.484264 2601:645:8001:cc60::313b → 2001:558:feed:443::14 TLSv1.2 245 Application Data
   17   0.484380 2601:645:8001:cc60::313b → 2001:558:feed:443::14 TLSv1.2 142 Application Data
   18   0.484410 2601:645:8001:cc60::313b → 2001:558:feed:443::14 TLSv1.2 245 Application Data
   19   0.484540 2601:645:8001:cc60::313b → 2001:558:feed:443::14 TLSv1.2 142 Application Data
   20   0.484564 2601:645:8001:cc60::313b → 2001:558:feed:443::14 TLSv1.2 245 Application Data
   21   0.496978 2001:558:feed:443::14 → 2601:645:8001:cc60::313b TCP 86 443 → 58373 [ACK] Seq=1 Ack=216 Win=51066 Len=0 TSval=2692285276 TSecr=76164393
   22   0.496979  65.8.161.48 → 10.0.0.156   TLSv1.2 105 Application Data
   23   0.497120   10.0.0.156 → 65.8.161.48  TCP 66 58553 → 443 [ACK] Seq=40 Ack=40 Win=2047 Len=0 TSval=3067624873 TSecr=428494732
   24   0.501991 2001:558:feed:443::14 → 2601:645:8001:cc60::313b TLSv1.2 125 Application Data
   25   0.501993 2001:558:feed:443::14 → 2601:645:8001:cc60::313b TLSv1.2 276 Application Data
   26   0.502101 2601:645:8001:cc60::313b → 2001:558:feed:443::14 TCP 86 58373 → 443 [ACK] Seq=646 Ack=230 Win=2044 Len=0 TSval=76164411 TSecr=2692285277
   27   0.505224 2001:558:feed:443::14 → 2601:645:8001:cc60::313b TCP 86 443 → 58373 [ACK] Seq=230 Ack=646 Win=51012 Len=0 TSval=2692285278 TSecr=76164393
   28   0.511452 2001:558:feed:443::14 → 2601:645:8001:cc60::313b TLSv1.2 125 Application Data
   29   0.511454 2001:558:feed:443::14 → 2601:645:8001:cc60::313b TLSv1.2 253 Application Data
   30   0.511563 2601:645:8001:cc60::313b → 2001:558:feed:443::14 TCP 86 58373 → 443 [ACK] Seq=646 Ack=436 Win=2044 Len=0 TSval=76164420 TSecr=2692285279
   31   0.512478 2001:558:feed:443::14 → 2601:645:8001:cc60::313b TCP 108 [TCP segment of a reassembled PDU]
   32   0.512479 2001:558:feed:443::14 → 2601:645:8001:cc60::313b TLSv1.2 285 Application Data
   33   0.512514 2601:645:8001:cc60::313b → 2001:558:feed:443::14 TCP 86 58373 → 443 [ACK] Seq=646 Ack=657 Win=2044 Len=0 TSval=76164420 TSecr=2692285280
   34   0.513539   10.0.0.156 → 172.64.146.152 UDP 1399 56460 → 443 Len=1357
   35   0.513561   10.0.0.156 → 172.64.146.152 UDP 387 56460 → 443 Len=345
   36   0.513705 2601:645:8001:cc60::313b → 2001:558:feed:443::14 TLSv1.2 142 Application Data
   37   0.513758 2601:645:8001:cc60::313b → 2001:558:feed:443::14 TLSv1.2 245 Application Data
   38   0.513898 2601:645:8001:cc60::313b → 2001:558:feed:443::14 TLSv1.2 142 Application Data
   39   0.513921 2601:645:8001:cc60::313b → 2001:558:feed:443::14 TLSv1.2 245 Application Data
   40   0.537350 2001:558:feed:443::14 → 2601:645:8001:cc60::313b TCP 86 443 → 58373 [ACK] Seq=657 Ack=1076 Win=51012 Len=0 TSval=2692285286 TSecr=76164422
   41   0.538585 172.64.146.152 → 10.0.0.156   UDP 72 443 → 56460 Len=30
   42   0.542254 2001:558:feed:443::14 → 2601:645:8001:cc60::313b TCP 107 [TCP segment of a reassembled PDU]
   43   0.542255 2001:558:feed:443::14 → 2601:645:8001:cc60::313b TLSv1.2 243 Application Data
   44   0.542256 2001:558:feed:443::14 → 2601:645:8001:cc60::313b TCP 107 [TCP segment of a reassembled PDU]
   45   0.542256 2001:558:feed:443::14 → 2601:645:8001:cc60::313b TLSv1.2 217 Application Data
   46   0.542415 2601:645:8001:cc60::313b → 2001:558:feed:443::14 TCP 86 58373 → 443 [ACK] Seq=1076 Ack=987 Win=2042 Len=0 TSval=76164451 TSecr=2692285287
   47   0.627532 172.64.146.152 → 10.0.0.156   UDP 569 443 → 56460 Len=527
   48   0.628954   10.0.0.156 → 172.64.146.152 UDP 88 56460 → 443 Len=46
   49   0.645119 172.64.146.152 → 10.0.0.156   UDP 68 443 → 56460 Len=26
   50   0.667526   10.0.0.156 → 172.64.146.152 UDP 88 56460 → 443 Len=46
   51   0.835580 172.217.12.106 → 10.0.0.156   TLSv1.2 190 Application Data
   52   0.835585 172.217.12.106 → 10.0.0.156   TLSv1.2 97 Application Data
   53   0.835586 172.217.12.106 → 10.0.0.156   TLSv1.2 105 Application Data
   54   0.836704   10.0.0.156 → 172.217.12.106 TCP 66 61019 → 443 [ACK] Seq=1 Ack=281 Win=2048 Len=0 TSval=3851038126 TSecr=3260477761
   55   0.836861   10.0.0.156 → 172.217.12.106 TLSv1.2 105 Application Data
   56   0.860334 172.217.12.106 → 10.0.0.156   TCP 66 443 → 61019 [ACK] Seq=281 Ack=40 Win=489 Len=0 TSval=3260477785 TSecr=3851038128
   57   0.890247   10.0.0.156 → 172.217.12.106 TLSv1.2 436 Application Data
   58   0.904682 172.217.12.106 → 10.0.0.156   TCP 66 443 → 61019 [ACK] Seq=281 Ack=410 Win=489 Len=0 TSval=3260477830 TSecr=3851038181
   59   0.926784 172.217.12.106 → 10.0.0.156   TLSv1.2 135 Application Data
   60   0.926787 172.217.12.106 → 10.0.0.156   TLSv1.2 97 Application Data
   61   0.926787 172.217.12.106 → 10.0.0.156   TLSv1.2 105 Application Data
   62   0.927299   10.0.0.156 → 172.217.12.106 TCP 66 61019 → 443 [ACK] Seq=410 Ack=420 Win=2048 Len=0 TSval=3851038218 TSecr=3260477852
   63   0.927401   10.0.0.156 → 172.217.12.106 TLSv1.2 105 Application Data
   64   0.929104   10.0.0.156 → 172.217.12.106 TLSv1.2 807 Application Data
   65   0.950898 172.217.12.106 → 10.0.0.156   TCP 66 443 → 61019 [ACK] Seq=420 Ack=449 Win=489 Len=0 TSval=3260477875 TSecr=3851038218
   66   0.954399 172.217.12.106 → 10.0.0.156   TCP 66 443 → 61019 [ACK] Seq=420 Ack=1190 Win=489 Len=0 TSval=3260477879 TSecr=3851038220
   67   0.978550 172.217.12.106 → 10.0.0.156   TLSv1.2 133 Application Data
   68   0.978553 172.217.12.106 → 10.0.0.156   TLSv1.2 115 Application Data
   69   0.979211   10.0.0.156 → 172.217.12.106 TCP 66 61019 → 443 [ACK] Seq=1190 Ack=536 Win=2048 Len=0 TSval=3851038269 TSecr=3260477904
   70   1.014335 13.107.43.14 → 10.0.0.156   TLSv1.2 100 Application Data
   71   1.014584   10.0.0.156 → 13.107.43.14 TCP 54 58081 → 443 [ACK] Seq=1 Ack=47 Win=46012 Len=0
   72   1.134108 2601:645:8001:cc60::313b → 2001:558:feed:443::14 TLSv1.2 142 Application Data
   73   1.134263 2601:645:8001:cc60::313b → 2001:558:feed:443::14 TLSv1.2 245 Application Data
   74   1.134440 2601:645:8001:cc60::313b → 2001:558:feed:443::14 TLSv1.2 142 Application Data
   75   1.134471 2601:645:8001:cc60::313b → 2001:558:feed:443::14 TLSv1.2 245 Application Data
   76   1.134534 2601:645:8001:cc60::313b → 2001:558:feed:443::14 TLSv1.2 142 Application Data
   77   1.134558 2601:645:8001:cc60::313b → 2001:558:feed:443::14 TLSv1.2 245 Application Data
   78   1.143164 2601:645:8001:cc60:956f:9b4b:459d:c96a → 2607:f8b0:4005:806::200e TCP 1514 [TCP segment of a reassembled PDU]
   79   1.143214 2601:645:8001:cc60:956f:9b4b:459d:c96a → 2607:f8b0:4005:806::200e TLSv1.2 427 Application Data
   80   1.143320 2601:645:8001:cc60:956f:9b4b:459d:c96a → 2607:f8b0:4005:806::200e TLSv1.2 534 Application Data
   81   1.151699 2001:558:feed:443::14 → 2601:645:8001:cc60::313b TCP 86 443 → 58373 [ACK] Seq=987 Ack=1291 Win=51066 Len=0 TSval=2692285439 TSecr=76165043
   82   1.159016 2001:558:feed:443::14 → 2601:645:8001:cc60::313b TLSv1.2 124 Application Data
   83   1.159019 2001:558:feed:443::14 → 2601:645:8001:cc60::313b TLSv1.2 197 Application Data
   84   1.159219 2601:645:8001:cc60::313b → 2001:558:feed:443::14 TCP 86 58373 → 443 [ACK] Seq=1721 Ack=1136 Win=2045 Len=0 TSval=76165068 TSecr=2692285441
   85   1.160682 2001:558:feed:443::14 → 2601:645:8001:cc60::313b TCP 86 443 → 58373 [ACK] Seq=1136 Ack=1562 Win=51066 Len=0 TSval=2692285442 TSecr=76165043
   86   1.163707 2001:558:feed:443::14 → 2601:645:8001:cc60::313b TCP 107 [TCP segment of a reassembled PDU]
   87   1.163710 2001:558:feed:443::14 → 2601:645:8001:cc60::313b TLSv1.2 180 Application Data
   88   1.163941 2601:645:8001:cc60::313b → 2001:558:feed:443::14 TCP 86 58373 → 443 [ACK] Seq=1721 Ack=1251 Win=2046 Len=0 TSval=76165072 TSecr=2692285442
   89   1.167077 2001:558:feed:443::14 → 2601:645:8001:cc60::313b TLSv1.2 124 Application Data
   90   1.167080 2001:558:feed:443::14 → 2601:645:8001:cc60::313b TLSv1.2 219 Application Data
   91   1.167328 2601:645:8001:cc60::313b → 2001:558:feed:443::14 TCP 86 58373 → 443 [ACK] Seq=1721 Ack=1422 Win=2045 Len=0 TSval=76165076 TSecr=2692285443
   92   1.169428 2607:f8b0:4005:806::200e → 2601:645:8001:cc60:956f:9b4b:459d:c96a TCP 86 443 → 60965 [ACK] Seq=1 Ack=2218 Win=16313 Len=0 TSval=763525871 TSecr=2141205885
   93   1.193398 2607:f8b0:4005:806::200e → 2601:645:8001:cc60:956f:9b4b:459d:c96a TLSv1.2 634 Application Data
   94   1.193401 2607:f8b0:4005:806::200e → 2601:645:8001:cc60:956f:9b4b:459d:c96a TLSv1.2 471 Application Data
   95   1.193403 2607:f8b0:4005:806::200e → 2601:645:8001:cc60:956f:9b4b:459d:c96a TLSv1.2 243 Application Data
   96   1.193405 2607:f8b0:4005:806::200e → 2601:645:8001:cc60:956f:9b4b:459d:c96a TLSv1.2 125 Application Data
   97   1.193686 2601:645:8001:cc60:956f:9b4b:459d:c96a → 2607:f8b0:4005:806::200e TCP 86 60965 → 443 [ACK] Seq=2218 Ack=1130 Win=2030 Len=0 TSval=2141205935 TSecr=763525894
   98   1.194435 2601:645:8001:cc60:956f:9b4b:459d:c96a → 2607:f8b0:4005:806::200e TLSv1.2 125 Application Data
   99   1.214704 2607:f8b0:4005:806::200e → 2601:645:8001:cc60:956f:9b4b:459d:c96a TCP 86 443 → 60965 [ACK] Seq=1130 Ack=2257 Win=16315 Len=0 TSval=763525916 TSecr=2141205935
  100   1.347167 35.174.127.31 → 10.0.0.156   TLSv1.2 97 Application Data
  101   1.347224   10.0.0.156 → 35.174.127.31 TCP 66 58384 → 443 [ACK] Seq=1 Ack=32 Win=2047 Len=0 TSval=2391648383 TSecr=588159640
  102   1.347357   10.0.0.156 → 35.174.127.31 TLSv1.2 101 Application Data
  103   1.408231 2601:645:8001:cc60::313b → 2001:558:feed:443::14 TLSv1.2 142 Application Data
  104   1.408310 2601:645:8001:cc60::313b → 2001:558:feed:443::14 TLSv1.2 245 Application Data
  105   1.408393 2601:645:8001:cc60::313b → 2001:558:feed:443::14 TLSv1.2 142 Application Data
  106   1.408407 2601:645:8001:cc60::313b → 2001:558:feed:443::14 TLSv1.2 245 Application Data
  107   1.408446 2601:645:8001:cc60::313b → 2001:558:feed:443::14 TLSv1.2 142 Application Data
  108   1.408455 2601:645:8001:cc60::313b → 2001:558:feed:443::14 TLSv1.2 245 Application Data
  109   1.410835   10.0.0.156 → 13.107.43.14 TCP 1494 [TCP segment of a reassembled PDU]
  110   1.410836   10.0.0.156 → 13.107.43.14 TCP 1494 58081 → 443 [ACK] Seq=1441 Ack=47 Win=46013 Len=1440 [TCP segment of a reassembled PDU]
  111   1.410837   10.0.0.156 → 13.107.43.14 TCP 1494 58081 → 443 [ACK] Seq=2881 Ack=47 Win=46013 Len=1440 [TCP segment of a reassembled PDU]
  112   1.410855   10.0.0.156 → 13.107.43.14 TLSv1.2 330 Application Data
  113   1.410872   10.0.0.156 → 13.107.43.14 TLSv1.2 423 Application Data
  114   1.421663 2001:558:feed:443::14 → 2601:645:8001:cc60::313b TCP 86 443 → 58373 [ACK] Seq=1422 Ack=1936 Win=51066 Len=0 TSval=2692285507 TSecr=76165317
  115   1.427470 2001:558:feed:443::14 → 2601:645:8001:cc60::313b TLSv1.2 125 Application Data
  116   1.427471 2001:558:feed:443::14 → 2601:645:8001:cc60::313b TLSv1.2 262 Application Data
  117   1.427574 2601:645:8001:cc60::313b → 2001:558:feed:443::14 TCP 86 58373 → 443 [ACK] Seq=2366 Ack=1637 Win=2044 Len=0 TSval=76165336 TSecr=2692285509
  118   1.430226 2001:558:feed:443::14 → 2601:645:8001:cc60::313b TCP 86 443 → 58373 [ACK] Seq=1637 Ack=2207 Win=51066 Len=0 TSval=2692285509 TSecr=76165317
  119   1.434004 2001:558:feed:443::14 → 2601:645:8001:cc60::313b TLSv1.2 124 Application Data
  120   1.434005 2001:558:feed:443::14 → 2601:645:8001:cc60::313b TLSv1.2 277 Application Data
  121   1.434109 2601:645:8001:cc60::313b → 2001:558:feed:443::14 TCP 86 58373 → 443 [ACK] Seq=2366 Ack=1866 Win=2044 Len=0 TSval=76165343 TSecr=2692285510
  122   1.445548 2001:558:feed:443::14 → 2601:645:8001:cc60::313b TLSv1.2 125 Application Data
  123   1.445549 2001:558:feed:443::14 → 2601:645:8001:cc60::313b TLSv1.2 250 Application Data
  124   1.445645 2601:645:8001:cc60::313b → 2001:558:feed:443::14 TCP 86 58373 → 443 [ACK] Seq=2366 Ack=2069 Win=2044 Len=0 TSval=76165354 TSecr=2692285513
  125   1.452586 13.107.43.14 → 10.0.0.156   TCP 60 443 → 58081 [ACK] Seq=47 Ack=4966 Win=16385 Len=0
  126   1.473060 35.174.127.31 → 10.0.0.156   TCP 66 443 → 58384 [ACK] Seq=32 Ack=36 Win=2074 Len=0 TSval=588159768 TSecr=2391648383
  127   1.478995 13.107.43.14 → 10.0.0.156   TLSv1.2 239 Application Data
  128   1.479094   10.0.0.156 → 13.107.43.14 TCP 54 58081 → 443 [ACK] Seq=4966 Ack=232 Win=46010 Len=0
  129   1.593506 2601:645:8001:cc60:956f:9b4b:459d:c96a → 2607:f8b0:4005:806::200e TLSv1.2 125 Application Data
  130   1.593616   10.0.0.156 → 35.190.10.96 TLSv1.2 105 Application Data
  131   1.606243 2607:f8b0:4005:806::200e → 2601:645:8001:cc60:956f:9b4b:459d:c96a TLSv1.2 125 Application Data
  132   1.606359 2601:645:8001:cc60:956f:9b4b:459d:c96a → 2607:f8b0:4005:806::200e TCP 86 62026 → 443 [ACK] Seq=40 Ack=40 Win=2047 Len=0 TSval=307362284 TSecr=2985921588
  133   1.665829 35.190.10.96 → 10.0.0.156   TCP 66 443 → 62098 [ACK] Seq=1 Ack=40 Win=262 Len=0 TSval=799750115 TSecr=2627732775
  134   1.665830 35.190.10.96 → 10.0.0.156   TLSv1.2 105 Application Data
  135   1.665946   10.0.0.156 → 35.190.10.96 TCP 66 62098 → 443 [ACK] Seq=40 Ack=40 Win=2047 Len=0 TSval=2627732848 TSecr=799750115
  136   1.871658 44.208.160.250 → 10.0.0.156   TCP 66 443 → 62060 [ACK] Seq=1 Ack=1 Win=482 Len=0 TSval=1873254293 TSecr=3577952117
  137   1.871758   10.0.0.156 → 44.208.160.250 TCP 66 [TCP ACKed unseen segment] 62060 → 443 [ACK] Seq=1 Ack=2 Win=2048 Len=0 TSval=3577967198 TSecr=1873239213
  138   2.276361   10.0.0.156 → 208.89.12.87 TLSv1.2 242 Application Data
  139   2.358332 208.89.12.87 → 10.0.0.156   TCP 66 443 → 61567 [ACK] Seq=1 Ack=177 Win=22111 Len=0 TSval=784655528 TSecr=1425665044
  140   2.370595 208.89.12.87 → 10.0.0.156   TLSv1.2 962 Application Data
  141   2.370718   10.0.0.156 → 208.89.12.87 TCP 66 61567 → 443 [ACK] Seq=177 Ack=897 Win=65535 Len=0 TSval=1425665138 TSecr=784655539
  142   3.071966 fe80::966a:77ff:fe4e:5b98 → ff02::1      ICMPv6 174 Router Advertisement from 94:6a:77:4e:5b:98
  143   3.520583 2601:645:8001:cc60::313b → 2001:558:feed:443::14 TLSv1.2 142 Application Data
  144   3.520728 2601:645:8001:cc60::313b → 2001:558:feed:443::14 TLSv1.2 245 Application Data
  145   3.521076 2601:645:8001:cc60::313b → 2001:558:feed:443::14 TLSv1.2 142 Application Data
  146   3.521102 2601:645:8001:cc60::313b → 2001:558:feed:443::14 TLSv1.2 245 Application Data
  147   3.521223 2601:645:8001:cc60::313b → 2001:558:feed:443::14 TLSv1.2 142 Application Data
  148   3.521242 2601:645:8001:cc60::313b → 2001:558:feed:443::14 TLSv1.2 245 Application Data
  149   3.526569 35.83.181.24 → 10.0.0.156   TLSv1.2 1142 Application Data
  150   3.526723   10.0.0.156 → 35.83.181.24 TCP 66 58424 → 443 [ACK] Seq=1 Ack=1179 Win=2031 Len=0 TSval=2244258103 TSecr=1798621928
  151   3.538190 2001:558:feed:443::14 → 2601:645:8001:cc60::313b TCP 86 443 → 58373 [ACK] Seq=2069 Ack=2581 Win=51066 Len=0 TSval=2692286036 TSecr=76167429
  152   3.540329 2001:558:feed:443::14 → 2601:645:8001:cc60::313b TLSv1.2 125 Application Data
  153   3.540331 2001:558:feed:443::14 → 2601:645:8001:cc60::313b TLSv1.2 276 Application Data
  154   3.540506 2601:645:8001:cc60::313b → 2001:558:feed:443::14 TCP 86 58373 → 443 [ACK] Seq=3011 Ack=2298 Win=2044 Len=0 TSval=76167449 TSecr=2692286037
  155   3.546932 2001:558:feed:443::14 → 2601:645:8001:cc60::313b TCP 86 443 → 58373 [ACK] Seq=2298 Ack=3011 Win=51012 Len=0 TSval=2692286038 TSecr=76167429
  156   3.549855 2001:558:feed:443::14 → 2601:645:8001:cc60::313b TLSv1.2 125 Application Data
  157   3.549857 2001:558:feed:443::14 → 2601:645:8001:cc60::313b TLSv1.2 290 Application Data
  158   3.550007 2601:645:8001:cc60::313b → 2001:558:feed:443::14 TCP 86 58373 → 443 [ACK] Seq=3011 Ack=2541 Win=2044 Len=0 TSval=76167459 TSecr=2692286039
  159   3.551464   10.0.0.156 → 172.64.146.152 UDP 788 58416 → 443 Len=746
  160   3.551621   10.0.0.156 → 172.64.146.152 UDP 1399 56460 → 443 Len=1357
  161   3.551647   10.0.0.156 → 172.64.146.152 UDP 1399 56460 → 443 Len=1357
  162   3.551681   10.0.0.156 → 172.64.146.152 UDP 1399 56460 → 443 Len=1357
  163   3.551722   10.0.0.156 → 172.64.146.152 UDP 1399 56460 → 443 Len=1357
  164   3.551744   10.0.0.156 → 172.64.146.152 UDP 1003 56460 → 443 Len=961
  165   3.551918 2601:645:8001:cc60::313b → 2001:558:feed:443::14 TLSv1.2 142 Application Data
  166   3.551983 2601:645:8001:cc60::313b → 2001:558:feed:443::14 TLSv1.2 245 Application Data
  167   3.552114 2601:645:8001:cc60::313b → 2001:558:feed:443::14 TLSv1.2 142 Application Data
  168   3.552139 2601:645:8001:cc60::313b → 2001:558:feed:443::14 TLSv1.2 245 Application Data
  169   3.554276 2001:558:feed:443::14 → 2601:645:8001:cc60::313b TLSv1.2 125 Application Data
  170   3.554277 2001:558:feed:443::14 → 2601:645:8001:cc60::313b TLSv1.2 253 Application Data
  171   3.554388 2601:645:8001:cc60::313b → 2001:558:feed:443::14 TCP 86 58373 → 443 [ACK] Seq=3441 Ack=2747 Win=2044 Len=0 TSval=76167463 TSecr=2692286040
  172   3.574501 2001:558:feed:443::14 → 2601:645:8001:cc60::313b TCP 86 443 → 58373 [ACK] Seq=2747 Ack=3441 Win=51012 Len=0 TSval=2692286045 TSecr=76167461
  173   3.574504 172.64.146.152 → 10.0.0.156   UDP 72 443 → 56460 Len=30
  174   3.574505 172.64.146.152 → 10.0.0.156   UDP 71 443 → 58416 Len=29
  175   3.577312 2001:558:feed:443::14 → 2601:645:8001:cc60::313b TCP 107 [TCP segment of a reassembled PDU]
  176   3.577313 2001:558:feed:443::14 → 2601:645:8001:cc60::313b TLSv1.2 243 Application Data
  177   3.577314 2001:558:feed:443::14 → 2601:645:8001:cc60::313b TCP 107 [TCP segment of a reassembled PDU]
  178   3.577315 2001:558:feed:443::14 → 2601:645:8001:cc60::313b TLSv1.2 217 Application Data
  179   3.577503 2601:645:8001:cc60::313b → 2001:558:feed:443::14 TCP 86 58373 → 443 [ACK] Seq=3441 Ack=3077 Win=2042 Len=0 TSval=76167486 TSecr=2692286046
  180   3.614338 172.64.146.152 → 10.0.0.156   UDP 357 443 → 58416 Len=315
  181   3.615857   10.0.0.156 → 172.64.146.152 UDP 88 58416 → 443 Len=46
  182   3.633385 172.64.146.152 → 10.0.0.156   UDP 68 443 → 58416 Len=26
  183   3.653938   10.0.0.156 → 172.64.146.152 UDP 88 58416 → 443 Len=46
  184   3.656423 172.64.146.152 → 10.0.0.156   UDP 836 443 → 56460 Len=794
  185   3.657720   10.0.0.156 → 172.64.146.152 UDP 88 56460 → 443 Len=46
  186   3.668994 172.64.146.152 → 10.0.0.156   UDP 68 443 → 56460 Len=26
  187   3.690352   10.0.0.156 → 172.64.146.152 UDP 88 56460 → 443 Len=46
  188   3.875503   10.0.0.156 → 54.244.189.41 TCP 54 61967 → 443 [ACK] Seq=1 Ack=1 Win=2048 Len=0
  189   3.911380 54.244.189.41 → 10.0.0.156   TCP 66 [TCP ACKed unseen segment] 443 → 61967 [ACK] Seq=1 Ack=2 Win=27 Len=0 TSval=2248426713 TSecr=71915783
  190   3.950671   10.0.0.156 → 54.244.189.41 TCP 54 62061 → 443 [ACK] Seq=1 Ack=1 Win=2048 Len=0
  191   3.962608 34.201.239.212 → 10.0.0.156   TLSv1.2 101 Application Data
  192   3.963163   10.0.0.156 → 34.201.239.212 TCP 66 60091 → 443 [ACK] Seq=1 Ack=36 Win=2048 Len=0 TSval=3311230643 TSecr=1337932859
  193   3.979983 2601:645:8001:cc60::313b → 2001:558:feed:443::14 TLSv1.2 142 Application Data
  194   3.980203 2601:645:8001:cc60::313b → 2001:558:feed:443::14 TLSv1.2 245 Application Data
  195   3.983110 2601:645:8001:cc60::313b → 2001:558:feed:443::14 TLSv1.2 142 Application Data
  196   3.983203 2601:645:8001:cc60::313b → 2001:558:feed:443::14 TLSv1.2 245 Application Data
  197   3.983410 2601:645:8001:cc60::313b → 2001:558:feed:443::14 TLSv1.2 142 Application Data
  198   3.983441 2601:645:8001:cc60::313b → 2001:558:feed:443::14 TLSv1.2 245 Application Data
  199   3.983909 54.244.189.41 → 10.0.0.156   TCP 66 [TCP ACKed unseen segment] 443 → 62061 [ACK] Seq=1 Ack=2 Win=27 Len=0 TSval=2248426786 TSecr=1273500815
  200   3.994176 2001:558:feed:443::14 → 2601:645:8001:cc60::313b TCP 86 443 → 58373 [ACK] Seq=3077 Ack=3656 Win=51066 Len=0 TSval=2692286150 TSecr=76167888
  201   3.994646   10.0.0.156 → 54.244.189.41 TLSv1.2 832 Application Data
  202   3.998349 2001:558:feed:443::14 → 2601:645:8001:cc60::313b TLSv1.2 124 Application Data
  203   3.998352 2001:558:feed:443::14 → 2601:645:8001:cc60::313b TLSv1.2 339 Application Data
  204   3.998588 2601:645:8001:cc60::313b → 2001:558:feed:443::14 TCP 86 58373 → 443 [ACK] Seq=4086 Ack=3368 Win=2043 Len=0 TSval=76167907 TSecr=2692286151
  205   4.003177 2001:558:feed:443::14 → 2601:645:8001:cc60::313b TCP 86 443 → 58373 [ACK] Seq=3368 Ack=3927 Win=51066 Len=0 TSval=2692286152 TSecr=76167892
  206   4.005972 2001:558:feed:443::14 → 2601:645:8001:cc60::313b TLSv1.2 124 Application Data
  207   4.005974 2001:558:feed:443::14 → 2601:645:8001:cc60::313b TLSv1.2 339 Application Data
  208   4.006220 2601:645:8001:cc60::313b → 2001:558:feed:443::14 TCP 86 58373 → 443 [ACK] Seq=4086 Ack=3659 Win=2043 Len=0 TSval=76167915 TSecr=2692286153
  209   4.007984 2001:558:feed:443::14 → 2601:645:8001:cc60::313b TCP 107 [TCP segment of a reassembled PDU]
  210   4.007987 2001:558:feed:443::14 → 2601:645:8001:cc60::313b TLSv1.2 282 Application Data
  211   4.008206 2601:645:8001:cc60::313b → 2001:558:feed:443::14 TCP 86 58373 → 443 [ACK] Seq=4086 Ack=3876 Win=2044 Len=0 TSval=76167917 TSecr=2692286153
  212   4.032352 54.244.189.41 → 10.0.0.156   TLSv1.2 761 Application Data
  213   4.032476   10.0.0.156 → 54.244.189.41 TCP 66 61422 → 443 [ACK] Seq=767 Ack=696 Win=2037 Len=0 TSval=750678984 TSecr=1326833559
  214   4.033788   10.0.0.156 → 54.244.189.41 TCP 1514 [TCP segment of a reassembled PDU]
  215   4.033809   10.0.0.156 → 54.244.189.41 TLSv1.2 724 Application Data
  216   4.077237 54.244.189.41 → 10.0.0.156   TCP 66 443 → 62113 [ACK] Seq=1 Ack=2107 Win=17 Len=0 TSval=3933444100 TSecr=188832581
  217   4.077240 54.244.189.41 → 10.0.0.156   TLSv1.2 761 Application Data
  218   4.077519   10.0.0.156 → 54.244.189.41 TCP 66 62113 → 443 [ACK] Seq=2107 Ack=696 Win=2037 Len=0 TSval=188832625 TSecr=3933444100
  219   4.202482 34.201.239.212 → 10.0.0.156   TLSv1.2 99 Application Data
  220   4.202891   10.0.0.156 → 34.201.239.212 TCP 66 60091 → 443 [ACK] Seq=1 Ack=69 Win=2048 Len=0 TSval=3311230883 TSecr=1337933099
  221   4.224394 13.107.43.14 → 10.0.0.156   TLSv1.2 100 Application Data
  222   4.224593   10.0.0.156 → 13.107.43.14 TCP 54 58081 → 443 [ACK] Seq=4966 Ack=278 Win=46012 Len=0
  223   4.274045 2601:645:8001:cc60::313b → 2001:558:feed:443::14 TLSv1.2 142 Application Data
  224   4.274205 2601:645:8001:cc60::313b → 2001:558:feed:443::14 TLSv1.2 245 Application Data
  225   4.274398 2601:645:8001:cc60::313b → 2001:558:feed:443::14 TLSv1.2 142 Application Data
  226   4.274425 2601:645:8001:cc60::313b → 2001:558:feed:443::14 TLSv1.2 245 Application Data
  227   4.274532 2601:645:8001:cc60::313b → 2001:558:feed:443::14 TLSv1.2 142 Application Data
  228   4.274553 2601:645:8001:cc60::313b → 2001:558:feed:443::14 TLSv1.2 245 Application Data
  229   4.283215   10.0.0.156 → 34.201.239.212 TLSv1.2 188 Application Data
  230   4.290985 2001:558:feed:443::14 → 2601:645:8001:cc60::313b TCP 86 443 → 58373 [ACK] Seq=3876 Ack=4301 Win=51066 Len=0 TSval=2692286224 TSecr=76168183
  231   4.294024 2001:558:feed:443::14 → 2601:645:8001:cc60::313b TLSv1.2 124 Application Data
  232   4.294027 2001:558:feed:443::14 → 2601:645:8001:cc60::313b TLSv1.2 341 Application Data
  233   4.294213 2601:645:8001:cc60::313b → 2001:558:feed:443::14 TCP 86 58373 → 443 [ACK] Seq=4731 Ack=4169 Win=2043 Len=0 TSval=76168203 TSecr=2692286225
  234   4.300287 2001:558:feed:443::14 → 2601:645:8001:cc60::313b TCP 86 443 → 58373 [ACK] Seq=4169 Ack=4572 Win=51066 Len=0 TSval=2692286227 TSecr=76168183
  235   4.302203 2001:558:feed:443::14 → 2601:645:8001:cc60::313b TCP 108 [TCP segment of a reassembled PDU]
  236   4.302205 2001:558:feed:443::14 → 2601:645:8001:cc60::313b TLSv1.2 300 Application Data
  237   4.302410 2601:645:8001:cc60::313b → 2001:558:feed:443::14 TCP 86 58373 → 443 [ACK] Seq=4731 Ack=4405 Win=2044 Len=0 TSval=76168211 TSecr=2692286227
  238   4.304763 2001:558:feed:443::14 → 2601:645:8001:cc60::313b TLSv1.2 124 Application Data
  239   4.304764 2001:558:feed:443::14 → 2601:645:8001:cc60::313b TLSv1.2 341 Application Data
  240   4.304946 2601:645:8001:cc60::313b → 2001:558:feed:443::14 TCP 86 58373 → 443 [ACK] Seq=4731 Ack=4698 Win=2043 Len=0 TSval=76168213 TSecr=2692286228
  241   4.377004 34.201.239.212 → 10.0.0.156   TLSv1.2 397 Application Data
  242   4.377226   10.0.0.156 → 34.201.239.212 TCP 66 60091 → 443 [ACK] Seq=123 Ack=400 Win=2042 Len=0 TSval=3311231058 TSecr=1337933274
  243   4.380057   10.0.0.156 → 35.83.181.24 TLSv1.2 120 Application Data
  244   4.396710   10.0.0.156 → 34.201.239.212 TLSv1.2 188 Application Data
  245   4.396908   10.0.0.156 → 34.201.239.212 TLSv1.2 99 Application Data
  246   4.411365 35.83.181.24 → 10.0.0.156   TCP 66 443 → 58424 [ACK] Seq=1179 Ack=55 Win=8 Len=0 TSval=1798623023 TSecr=2244258957
  247   4.411367 35.83.181.24 → 10.0.0.156   TLSv1.2 122 Application Data
  248   4.411570   10.0.0.156 → 35.83.181.24 TCP 66 58424 → 443 [ACK] Seq=55 Ack=1235 Win=2047 Len=0 TSval=2244258988 TSecr=1798623023
  249   4.479310 34.201.239.212 → 10.0.0.156   TCP 66 443 → 60091 [ACK] Seq=400 Ack=278 Win=502 Len=0 TSval=1337933376 TSecr=3311231077
  250   4.479313 34.201.239.212 → 10.0.0.156   TLSv1.2 114 Application Data
  251   4.479602   10.0.0.156 → 34.201.239.212 TCP 66 60091 → 443 [ACK] Seq=278 Ack=448 Win=2047 Len=0 TSval=3311231160 TSecr=1337933377
  252   4.481523 34.201.239.212 → 10.0.0.156   TLSv1.2 295 Application Data
  253   4.481795   10.0.0.156 → 34.201.239.212 TCP 66 60091 → 443 [ACK] Seq=278 Ack=677 Win=2048 Len=0 TSval=3311231162 TSecr=1337933379
  254   4.492649 2601:645:8001:cc60::313b → 2001:558:feed:443::14 TLSv1.2 142 Application Data
  255   4.492759 2601:645:8001:cc60::313b → 2001:558:feed:443::14 TLSv1.2 245 Application Data
  256   4.492989 2601:645:8001:cc60::313b → 2001:558:feed:443::14 TLSv1.2 142 Application Data
  257   4.493022 2601:645:8001:cc60::313b → 2001:558:feed:443::14 TLSv1.2 245 Application Data
  258   4.493284 2601:645:8001:cc60::313b → 2001:558:feed:443::14 TLSv1.2 142 Application Data
  259   4.493321 2601:645:8001:cc60::313b → 2001:558:feed:443::14 TLSv1.2 245 Application Data
  260   4.497763 2601:645:8001:cc60:956f:9b4b:459d:c96a → 2607:f8b0:4005:806::200e TLSv1.2 1196 Application Data
  261   4.497824 2601:645:8001:cc60:956f:9b4b:459d:c96a → 2607:f8b0:4005:806::200e TLSv1.2 1290 Application Data
  262   4.509006 2001:558:feed:443::14 → 2601:645:8001:cc60::313b TCP 86 443 → 58373 [ACK] Seq=4698 Ack=4946 Win=51066 Len=0 TSval=2692286279 TSecr=76168401
  263   4.512994 2001:558:feed:443::14 → 2601:645:8001:cc60::313b TCP 107 [TCP segment of a reassembled PDU]
  264   4.512999 2001:558:feed:443::14 → 2601:645:8001:cc60::313b TLSv1.2 192 Application Data
  265   4.513246 2601:645:8001:cc60::313b → 2001:558:feed:443::14 TCP 86 58373 → 443 [ACK] Seq=5376 Ack=4825 Win=2046 Len=0 TSval=76168422 TSecr=2692286280
  266   4.518057 2001:558:feed:443::14 → 2601:645:8001:cc60::313b TCP 86 443 → 58373 [ACK] Seq=4825 Ack=5217 Win=51066 Len=0 TSval=2692286281 TSecr=76168401
  267   4.518061 2607:f8b0:4005:806::200e → 2601:645:8001:cc60:956f:9b4b:459d:c96a TCP 86 443 → 60965 [ACK] Seq=1130 Ack=4571 Win=16311 Len=0 TSval=763529219 TSecr=2141209239
  268   4.519827 2001:558:feed:443::14 → 2601:645:8001:cc60::313b TCP 107 [TCP segment of a reassembled PDU]
  269   4.519829 2001:558:feed:443::14 → 2601:645:8001:cc60::313b TLSv1.2 180 Application Data
  270   4.519830 2001:558:feed:443::14 → 2601:645:8001:cc60::313b TLSv1.2 124 Application Data
  271   4.520095 2601:645:8001:cc60::313b → 2001:558:feed:443::14 TCP 86 58373 → 443 [ACK] Seq=5376 Ack=4978 Win=2045 Len=0 TSval=76168429 TSecr=2692286282
  272   4.521299 2001:558:feed:443::14 → 2601:645:8001:cc60::313b TLSv1.2 219 Application Data
  273   4.521358 2601:645:8001:cc60::313b → 2001:558:feed:443::14 TCP 86 58373 → 443 [ACK] Seq=5376 Ack=5111 Win=2045 Len=0 TSval=76168430 TSecr=2692286282
  274   4.540610 2607:f8b0:4005:806::200e → 2601:645:8001:cc60:956f:9b4b:459d:c96a TLSv1.2 636 Application Data
  275   4.540613 2607:f8b0:4005:806::200e → 2601:645:8001:cc60:956f:9b4b:459d:c96a TLSv1.2 452 Application Data
  276   4.540614 2607:f8b0:4005:806::200e → 2601:645:8001:cc60:956f:9b4b:459d:c96a TLSv1.2 276 Application Data
  277   4.540615 2607:f8b0:4005:806::200e → 2601:645:8001:cc60:956f:9b4b:459d:c96a TLSv1.2 125 Application Data
  278   4.541186 fe80::966a:77ff:fe4e:5b98 → 2601:645:8001:cc60:956f:9b4b:459d:c96a ICMPv6 86 Neighbor Solicitation for 2601:645:8001:cc60:956f:9b4b:459d:c96a from 94:6a:77:4e:5b:98
  279   4.541233 2601:645:8001:cc60:956f:9b4b:459d:c96a → 2607:f8b0:4005:806::200e TCP 86 60965 → 443 [ACK] Seq=4571 Ack=2275 Win=2030 Len=0 TSval=2141209282 TSecr=763529241
  280   4.541290 fe80::44c:79c7:8f56:e809 → fe80::966a:77ff:fe4e:5b98 ICMPv6 78 Neighbor Advertisement 2601:645:8001:cc60:956f:9b4b:459d:c96a (sol)
  281   4.541359 2601:645:8001:cc60:956f:9b4b:459d:c96a → 2607:f8b0:4005:806::200e TLSv1.2 125 Application Data
  282   4.563548 2607:f8b0:4005:806::200e → 2601:645:8001:cc60:956f:9b4b:459d:c96a TCP 86 443 → 60965 [ACK] Seq=2275 Ack=4610 Win=16315 Len=0 TSval=763529265 TSecr=2141209282
  283   4.636366   10.0.0.156 → 35.83.181.24 TLSv1.2 120 Application Data
  284   4.671851 35.83.181.24 → 10.0.0.156   TCP 66 443 → 58426 [ACK] Seq=1 Ack=55 Win=8 Len=0 TSval=3055569070 TSecr=3604563899
  285   4.671854 35.83.181.24 → 10.0.0.156   TLSv1.2 122 Application Data
  286   4.672136   10.0.0.156 → 35.83.181.24 TCP 66 58426 → 443 [ACK] Seq=55 Ack=57 Win=2047 Len=0 TSval=3604563935 TSecr=3055569071
  287   4.970360   10.0.0.156 → 35.83.181.24 TLSv1.2 120 Application Data
  288   5.009863 35.83.181.24 → 10.0.0.156   TCP 66 443 → 58428 [ACK] Seq=1 Ack=55 Win=8 Len=0 TSval=1925757929 TSecr=283872655
  289   5.009866 35.83.181.24 → 10.0.0.156   TLSv1.2 122 Application Data
  290   5.010123   10.0.0.156 → 35.83.181.24 TCP 66 58428 → 443 [ACK] Seq=55 Ack=57 Win=2047 Len=0 TSval=283872695 TSecr=1925757929
  291   5.194091   10.0.0.156 → 54.71.187.8  TLSv1.2 108 Application Data
  292   5.231245  54.71.187.8 → 10.0.0.156   TLSv1.2 104 Application Data
  293   5.231531   10.0.0.156 → 54.71.187.8  TCP 66 58467 → 443 [ACK] Seq=43 Ack=39 Win=2047 Len=0 TSval=2172715082 TSecr=3986120730
  294   5.374261 35.83.181.24 → 10.0.0.156   TLSv1.2 1137 Application Data
  295   5.374514   10.0.0.156 → 35.83.181.24 TCP 66 58459 → 443 [ACK] Seq=55 Ack=1128 Win=2031 Len=0 TSval=2258857788 TSecr=1690055367
  296   5.448487 169.254.100.1 → 239.255.255.250 SSDP 228 M-SEARCH * HTTP/1.1 
  297   5.448490 169.254.100.1 → 239.255.255.250 SSDP 232 M-SEARCH * HTTP/1.1 
  298   5.448493 169.254.100.1 → 239.255.255.250 SSDP 236 M-SEARCH * HTTP/1.1 
  299   5.454609 169.254.100.1 → 239.255.255.250 SSDP 229 M-SEARCH * HTTP/1.1 
  300   5.462145 172.217.12.106 → 10.0.0.156   TLSv1.2 192 Application Data
  301   5.462392   10.0.0.156 → 172.217.12.106 TCP 66 61019 → 443 [ACK] Seq=1190 Ack=662 Win=2048 Len=0 TSval=3851042753 TSecr=3260482387
  302   5.838201 54.244.189.41 → 10.0.0.156   TCP 66 [TCP Keep-Alive] 443 → 62061 [ACK] Seq=0 Ack=2 Win=27 Len=0 TSval=2248428535 TSecr=1273500815
  303   5.838298   10.0.0.156 → 54.244.189.41 TCP 66 [TCP Previous segment not captured] 62061 → 443 [ACK] Seq=2 Ack=1 Win=2048 Len=0 TSval=1273512704 TSecr=2248426786
  304   6.005358   10.0.0.156 → 65.8.161.48  TLSv1.2 105 Application Data
  305   6.011378 13.107.43.14 → 10.0.0.156   TLSv1.2 115 Application Data
  306   6.011462   10.0.0.156 → 13.107.43.14 TCP 54 58081 → 443 [ACK] Seq=4966 Ack=339 Win=46012 Len=0
  307   6.023765  65.8.161.48 → 10.0.0.156   TLSv1.2 105 Application Data
  308   6.023877   10.0.0.156 → 65.8.161.48  TCP 66 58553 → 443 [ACK] Seq=79 Ack=79 Win=2047 Len=0 TSval=3067630399 TSecr=428500259
  309   6.143693 fe80::966a:77ff:fe4e:5b98 → ff02::1      ICMPv6 174 Router Advertisement from 94:6a:77:4e:5b:98
  310   6.398702   10.0.0.156 → 35.83.181.24 TLSv1.2 120 Application Data
  311   6.415018 172.217.12.106 → 10.0.0.156   TLSv1.2 192 Application Data
  312   6.415019 172.217.12.106 → 10.0.0.156   TLSv1.2 97 Application Data
  313   6.415020 172.217.12.106 → 10.0.0.156   TLSv1.2 105 Application Data
  314   6.415321   10.0.0.156 → 172.217.12.106 TCP 66 61019 → 443 [ACK] Seq=1190 Ack=858 Win=2048 Len=0 TSval=3851043706 TSecr=3260483340
  315   6.415382   10.0.0.156 → 172.217.12.106 TLSv1.2 105 Application Data
  316   6.429840   10.0.0.156 → 172.217.12.106 TLSv1.2 302 Application Data
  317   6.435318 172.217.12.106 → 10.0.0.156   TCP 66 443 → 61019 [ACK] Seq=858 Ack=1229 Win=489 Len=0 TSval=3260483360 TSecr=3851043706
  318   6.435319 35.83.181.24 → 10.0.0.156   TCP 66 443 → 58436 [ACK] Seq=1 Ack=55 Win=8 Len=0 TSval=3700203234 TSecr=1699175293
  319   6.435319 35.83.181.24 → 10.0.0.156   TLSv1.2 122 Application Data
  320   6.435418   10.0.0.156 → 35.83.181.24 TCP 66 58436 → 443 [ACK] Seq=55 Ack=57 Win=2047 Len=0 TSval=1699175330 TSecr=3700203234
  321   6.444456 172.217.12.106 → 10.0.0.156   TCP 66 443 → 61019 [ACK] Seq=858 Ack=1465 Win=489 Len=0 TSval=3260483368 TSecr=3851043720
  322   6.468861 172.217.12.106 → 10.0.0.156   TLSv1.2 135 Application Data
  323   6.468862 172.217.12.106 → 10.0.0.156   TLSv1.2 97 Application Data
  324   6.468862 172.217.12.106 → 10.0.0.156   TLSv1.2 105 Application Data
  325   6.469244   10.0.0.156 → 172.217.12.106 TCP 66 61019 → 443 [ACK] Seq=1465 Ack=997 Win=2048 Len=0 TSval=3851043760 TSecr=3260483394
  326   6.469308   10.0.0.156 → 172.217.12.106 TLSv1.2 105 Application Data
  327   6.470269   10.0.0.156 → 172.217.12.106 TLSv1.2 591 Application Data
  328   6.489530 172.217.12.106 → 10.0.0.156   TCP 66 443 → 61019 [ACK] Seq=997 Ack=1504 Win=489 Len=0 TSval=3260483414 TSecr=3851043760
  329   6.494765 172.217.12.106 → 10.0.0.156   TCP 66 443 → 61019 [ACK] Seq=997 Ack=2029 Win=489 Len=0 TSval=3260483419 TSecr=3851043761
  330   6.518253 172.217.12.106 → 10.0.0.156   TLSv1.2 133 Application Data
  331   6.518255 172.217.12.106 → 10.0.0.156   TLSv1.2 115 Application Data
  332   6.518643   10.0.0.156 → 172.217.12.106 TCP 66 61019 → 443 [ACK] Seq=2029 Ack=1113 Win=2048 Len=0 TSval=3851043809 TSecr=3260483442
  333   6.599824 172.217.12.106 → 10.0.0.156   TLSv1.2 190 Application Data
  334   6.599825 172.217.12.106 → 10.0.0.156   TLSv1.2 97 Application Data
  335   6.599826 172.217.12.106 → 10.0.0.156   TLSv1.2 105 Application Data
  336   6.600200   10.0.0.156 → 172.217.12.106 TCP 66 61019 → 443 [ACK] Seq=2029 Ack=1307 Win=2048 Len=0 TSval=3851043891 TSecr=3260483525
  337   6.600271   10.0.0.156 → 172.217.12.106 TLSv1.2 105 Application Data
  338   6.619736 172.217.12.106 → 10.0.0.156   TCP 66 443 → 61019 [ACK] Seq=1307 Ack=2068 Win=489 Len=0 TSval=3260483543 TSecr=3851043891
  339   6.624101   10.0.0.156 → 172.217.12.106 TLSv1.2 460 Application Data
  340   6.639412 172.217.12.106 → 10.0.0.156   TCP 66 443 → 61019 [ACK] Seq=1307 Ack=2462 Win=489 Len=0 TSval=3260483565 TSecr=3851043915
  341   6.666501 172.217.12.106 → 10.0.0.156   TLSv1.2 135 Application Data
  342   6.666503 172.217.12.106 → 10.0.0.156   TLSv1.2 97 Application Data
  343   6.666504 172.217.12.106 → 10.0.0.156   TLSv1.2 105 Application Data
  344   6.667333   10.0.0.156 → 172.217.12.106 TCP 66 61019 → 443 [ACK] Seq=2462 Ack=1446 Win=2048 Len=0 TSval=3851043957 TSecr=3260483592
  345   6.667429   10.0.0.156 → 172.217.12.106 TLSv1.2 105 Application Data
  346   6.669616   10.0.0.156 → 172.217.12.106 TLSv1.2 1029 Application Data
  347   6.688662 172.217.12.106 → 10.0.0.156   TCP 66 443 → 61019 [ACK] Seq=1446 Ack=2501 Win=489 Len=0 TSval=3260483614 TSecr=3851043957
  348   6.692495 172.217.12.106 → 10.0.0.156   TCP 66 443 → 61019 [ACK] Seq=1446 Ack=3464 Win=489 Len=0 TSval=3260483618 TSecr=3851043960
  349   6.721662 54.244.189.41 → 10.0.0.156   TCP 66 [TCP Keep-Alive] 443 → 62113 [ACK] Seq=695 Ack=2107 Win=17 Len=0 TSval=3933446739 TSecr=188832625
  350   6.721663 172.217.12.106 → 10.0.0.156   TLSv1.2 133 Application Data
  351   6.721663 172.217.12.106 → 10.0.0.156   TLSv1.2 115 Application Data
  352   6.721780   10.0.0.156 → 54.244.189.41 TCP 66 [TCP Window Update] 62113 → 443 [ACK] Seq=2107 Ack=696 Win=2048 Len=0 TSval=188835269 TSecr=3933444100
  353   6.721962   10.0.0.156 → 172.217.12.106 TCP 66 61019 → 443 [ACK] Seq=3464 Ack=1562 Win=2048 Len=0 TSval=3851044012 TSecr=3260483645
  354   6.790370 2601:645:8001:cc60::313b → 2001:558:feed:443::14 TLSv1.2 142 Application Data
  355   6.790475 2601:645:8001:cc60::313b → 2001:558:feed:443::14 TLSv1.2 245 Application Data
  356   6.790777 2601:645:8001:cc60::313b → 2001:558:feed:443::14 TLSv1.2 142 Application Data
  357   6.790820 2601:645:8001:cc60::313b → 2001:558:feed:443::14 TLSv1.2 245 Application Data
  358   6.790948 2601:645:8001:cc60::313b → 2001:558:feed:443::14 TLSv1.2 142 Application Data
  359   6.790976 2601:645:8001:cc60::313b → 2001:558:feed:443::14 TLSv1.2 245 Application Data
  360   6.795888   10.0.0.156 → 13.107.43.14 TCP 1494 [TCP segment of a reassembled PDU]
  361   6.795891   10.0.0.156 → 13.107.43.14 TCP 1494 58081 → 443 [ACK] Seq=6406 Ack=339 Win=46013 Len=1440 [TCP segment of a reassembled PDU]
  362   6.795911   10.0.0.156 → 13.107.43.14 TLSv1.2 642 Application Data
  363   6.795983   10.0.0.156 → 13.107.43.14 TLSv1.2 423 Application Data
  364   6.811163 2001:558:feed:443::14 → 2601:645:8001:cc60::313b TCP 86 443 → 58373 [ACK] Seq=5111 Ack=5591 Win=51066 Len=0 TSval=2692286854 TSecr=76170699
  365   6.812568 2001:558:feed:443::14 → 2601:645:8001:cc60::313b TCP 108 [TCP segment of a reassembled PDU]
  366   6.812569 2001:558:feed:443::14 → 2601:645:8001:cc60::313b TLSv1.2 257 Application Data
  367   6.812691 2601:645:8001:cc60::313b → 2001:558:feed:443::14 TCP 86 58373 → 443 [ACK] Seq=6021 Ack=5304 Win=2044 Len=0 TSval=76170721 TSecr=2692286855
  368   6.818193 2001:558:feed:443::14 → 2601:645:8001:cc60::313b TCP 86 443 → 58373 [ACK] Seq=5304 Ack=5862 Win=51066 Len=0 TSval=2692286856 TSecr=76170699
  369   6.825221 2001:558:feed:443::14 → 2601:645:8001:cc60::313b TLSv1.2 124 Application Data
  370   6.825224 2001:558:feed:443::14 → 2601:645:8001:cc60::313b TLSv1.2 277 Application Data
  371   6.825400 2601:645:8001:cc60::313b → 2001:558:feed:443::14 TCP 86 58373 → 443 [ACK] Seq=6021 Ack=5533 Win=2044 Len=0 TSval=76170734 TSecr=2692286858
  372   6.827395 2001:558:feed:443::14 → 2601:645:8001:cc60::313b TLSv1.2 125 Application Data
  373   6.827397 2001:558:feed:443::14 → 2601:645:8001:cc60::313b TLSv1.2 250 Application Data
  374   6.827513 2601:645:8001:cc60::313b → 2001:558:feed:443::14 TCP 86 58373 → 443 [ACK] Seq=6021 Ack=5736 Win=2044 Len=0 TSval=76170736 TSecr=2692286858
